"","baker","series","episode","technical","signature_bake","show_stopper","result","baker_name","baker_age","baker_occupation","hometown"
"1","Annetha",1,1,2,"Light Jamaican Black Cakewith Strawberries and Cream","Red, White & Blue Chocolate Cake with Cigarellos, Fresh Fruit, and Cream","IN","Annetha Mills",30,"Midwife","Essex"
"2","David",1,1,3,"Chocolate Orange Cake","Black Forest Floor Gateauxwith Moulded Chocolate Leaves, Fallen Fruitand Chocolate Mushrooms Moulded from eggs","IN","David Chambers",31,"Entrepreneur","Milton Keynes"
"3","Edd",1,1,1,"Caramel Cinnamon and Banana Cake",NA,"IN","Edd Kimber",24,"Debt collector for Yorkshire Bank","Bradford"
"4","Jasminder",1,1,NA,"Fresh Mango and Passion Fruit Hummingbird Cake",NA,"IN","Jasminder Randhawa",45,"Assistant Credit Control Manager","Birmingham"
"5","Jonathan",1,1,9,"Carrot Cake with Lime and Cream Cheese Icing","Three Tiered White and Dark Chocolate with Almond and Cherry","IN","Jonathan Shepherd",25,"Research Analyst","St Albans"
"6","Louise",1,1,NA,"Carrot and Orange Cake","Never Fail Chocolate Sponge Cake,with Fresh Fruit, White & Chocolate Cigarello Border","IN","Louise Brimelow",44,"Police Officer","Manchester"
"7","Miranda",1,1,8,"Triple Layered Brownie Meringue Cake
with Raspberry Cream","Three Tiered Chocolate Fudge Cake  with Handmade Chocolate Button Decorations","IN","Miranda Browne",37,"Food buyer for Marks & Spencer","Midhurst, West Sussex"
"8","Ruth",1,1,NA,"Three Tiered Lemon Drizzle Cakewith Fresh Cream and freshly made Lemon Curd","Classic Chocolate Sponge wrapped in a Chocolate Collartopped with Handmade White and Dark Chocolate Truffles","IN","Ruth Clemens",31,"Retail manager/Housewife","Poynton, Cheshire"
"9","Lea",1,1,10,"Cranberry and Pistachio Cakewith Orange Flower Water Icing","Raspberries and Cream filled Chocolatewith Chocolate-dipped Fresh Fruit","OUT","Lea Harris",51,"Retired","Midlothian, Scotland"
"10","Mark",1,1,NA,"Sticky Marmalade Tea Loaf","Heart-shaped Chocolate and Beetroot Cake with Store-Bought silver chocolate hearts and chocolate red and white roses.","OUT","Mark Whithers",48,"Bus Driver","South Wales"
"11","David",1,2,8,"Cheddar Cheese and Fresh Rosemary Biscuits","Choux Pastry Swans  Chocolate Profiteroles","IN","David Chambers",31,"Entrepreneur","Milton Keynes"
"12","Edd",1,2,6,"Oatmeal Raisin Cookie","Pink Macarons","IN","Edd Kimber",24,"Debt collector for Yorkshire Bank","Bradford"
"13","Jasminder",1,2,2,"Millionaires' Shortbread","Meringues with Chocolate and Space DustCoffee flavoured Eclairs","IN","Jasminder Randhawa",45,"Assistant Credit Control Manager","Birmingham"
"14","Jonathan",1,2,1,"Honey and Candied Ginger Cookies","Meringues with Whiskey Cream","IN","Jonathan Shepherd",25,"Research Analyst","St Albans"
"15","Miranda",1,2,3,"Fresh Vanilla Biscuits with Royal Icing","Pistachio Macarons","IN","Miranda Browne",37,"Food buyer for Marks & Spencer","Midhurst, West Sussex"
"16","Ruth",1,2,5,"Peanut Shortbread withSalted Peanut Caramel","Almond Macaron with Violet ButtercreamRaspberries and Cream Eclairs","IN","Ruth Clemens",31,"Retail manager/Housewife","Poynton, Cheshire"
"17","Annetha",1,2,7,"Rose Petal Shortbread","Pink Swirl Macarons / Eclairs","OUT","Annetha Mills",30,"Midwife","Essex"
"18","Louise",1,2,4,"Stained Glass Window Shortbread","Strawberry, Mint, and Cream Meringues  Chocolate Eclairs / Orange, Yellow and Pink Macarons","OUT","Louise Brimelow",44,"Police Officer","Manchester"
"19","Lea",1,2,NA,NA,NA,NA,"Lea Harris",51,"Retired","Midlothian, Scotland"
"20","Mark",1,2,NA,NA,NA,NA,"Mark Whithers",48,"Bus Driver","South Wales"
"21","David",1,3,4,"Chilli Bread","Walnut and Seed Roll
Red Berry and Almond Bun","IN","David Chambers",31,"Entrepreneur","Milton Keynes"
"22","Edd",1,3,1,"Olive Bread","Tomato and Mozzarella","IN","Edd Kimber",24,"Debt collector for Yorkshire Bank","Bradford"
"23","Jasminder",1,3,5,"Focaccia","Mango and Sultana Buns
Pan au Chocolat with Mars Bars
Tutti Frutti Wheel with Jelly Tots","IN","Jasminder Randhawa",45,"Assistant Credit Control Manager","Birmingham"
"24","Miranda",1,3,3,"Walnut and Apricot Bread","Lemon Iced Buns
Chocolate and Orange Buns","IN","Miranda Browne",37,"Food buyer for Marks & Spencer","Midhurst, West Sussex"
"25","Ruth",1,3,2,"Maple and Pecan Bread","Chocolate and Orange Panettone
Cranberry Bagels","IN","Ruth Clemens",31,"Retail manager/Housewife","Poynton, Cheshire"
"26","Jonathan",1,3,6,"Anchovy, Sweet Paprika and Oregano Bread","Sticky Lemon Honey Bun
Olive and Anchovy Roll
Sundried Tomatoes and Fresh Herbs Roll
Stilton, Walnut and Apple Roll
Cinnamon and Cardamom Chelsea Bun","OUT","Jonathan Shepherd",25,"Research Analyst","St Albans"
"27","Annetha",1,3,NA,NA,NA,NA,"Annetha Mills",30,"Midwife","Essex"
"28","Lea",1,3,NA,NA,NA,NA,"Lea Harris",51,"Retired","Midlothian, Scotland"
"29","Louise",1,3,NA,NA,NA,NA,"Louise Brimelow",44,"Police Officer","Manchester"
"30","Mark",1,3,NA,NA,NA,NA,"Mark Whithers",48,"Bus Driver","South Wales"
"31","Edd",1,4,3,"Apple and Plum Pudding","Apple and Cinnamon Crumble, Nutella Banana Brioche Bread Pudding, Rhubarb and Strawberry Suet Layer","IN","Edd Kimber",24,"Debt collector for Yorkshire Bank","Bradford"
"32","Jasminder",1,4,2,"Sticky Toffee Pudding with Tropical Fruit & Toffee Sauce","Bread & Butter Pudding, Treacle Suet Pudding with Fresh Fruit, Apple and Pineapple Crumble","IN","Jasminder Randhawa",45,"Assistant Credit Control Manager","Birmingham"
"33","Miranda",1,4,1,"Sticky Toffee Pudding","Queen of Puddings, Chocolate Pear Roly Poly, Strawberry and Rhubarb Crumble","IN","Miranda Browne",37,"Food buyer for Marks & Spencer","Midhurst, West Sussex"
"34","Ruth",1,4,4,"Peach and Blueberry Boy Bait","Apple & Ginger Crumble, Rhubarb Suet Crust, Cherry Queen of Puddings","IN","Ruth Clemens",31,"Retail manager/Housewife","Poynton, Cheshire"
"35","David",1,4,5,"Pear and Walnut Pudding","Apple and Blackberry Crumble, Rhubarb and Orange Betty, Suet Pear","OUT","David Chambers",31,"Entrepreneur","Milton Keynes"
"36","Annetha",1,4,NA,NA,NA,NA,"Annetha Mills",30,"Midwife","Essex"
"37","Jonathan",1,4,NA,NA,NA,NA,"Jonathan Shepherd",25,"Research Analyst","St Albans"
"38","Lea",1,4,NA,NA,NA,NA,"Lea Harris",51,"Retired","Midlothian, Scotland"
"39","Louise",1,4,NA,NA,NA,NA,"Louise Brimelow",44,"Police Officer","Manchester"
"40","Mark",1,4,NA,NA,NA,NA,"Mark Whithers",48,"Bus Driver","South Wales"
"41","Edd",1,5,2,"Chicken, Ham, Leek and Tarragon Pie","Almond Sweet Pastry with Ginger and Chocolate  Raspberry Tart / Yorkshire Curd Tart  Chickpea and Salami, Red and Yellow Pepper, Asparagus Gruyere Quiche Canapés","IN","Edd Kimber",24,"Debt collector for Yorkshire Bank","Bradford"
"42","Miranda",1,5,1,"Summery Salmon, Cod and Prawn Fish Pie","Chocolate Pastry filled with Orange Cheesecake  Chocolate Pastry filled with Milk Chocolate Ganche  Strawberry Tart with Red Currant Glaze  Cheesy Crab, Broad Bean and Tomato, Pancetta Risotto Canapés","IN","Miranda Browne",37,"Food buyer for Marks & Spencer","Midhurst, West Sussex"
"43","Ruth",1,5,3,"Minced Beef Pie","Raspberry and Dark Chocolate Tart  Creme Patisserie and Cherry Tart  Citrus Curd Tart with Creme Brulee top  Tomato, Asparagus Twirl Canapés","IN","Ruth Clemens",31,"Retail manager/Housewife","Poynton, Cheshire"
"44","Jasminder",1,5,4,"Chicken and Mushroom Pie","Jaggery, Carrot, and Spiced Condensed Milk Tart  Fruit and Custard Tart  Thai Chili Red Onion, Duck in Plum Sauce, Salmon and Prawn Canapés","OUT","Jasminder Randhawa",45,"Assistant Credit Control Manager","Birmingham"
"45","Annetha",1,5,NA,NA,NA,NA,"Annetha Mills",30,"Midwife","Essex"
"46","David",1,5,NA,NA,NA,NA,"David Chambers",31,"Entrepreneur","Milton Keynes"
"47","Jonathan",1,5,NA,NA,NA,NA,"Jonathan Shepherd",25,"Research Analyst","St Albans"
"48","Lea",1,5,NA,NA,NA,NA,"Lea Harris",51,"Retired","Midlothian, Scotland"
"49","Louise",1,5,NA,NA,NA,NA,"Louise Brimelow",44,"Police Officer","Manchester"
"50","Mark",1,5,NA,NA,NA,NA,"Mark Whithers",48,"Bus Driver","South Wales"
"51","Miranda",1,6,NA,"Lemon Cupcake","Eliminated after signature","Runner-up","Miranda Browne",37,"Food buyer for Marks & Spencer","Midhurst, West Sussex"
"52","Ruth",1,6,NA,"Mint, Ginger and Blackberry Cake",NA,"Runner-up","Ruth Clemens",31,"Retail manager/Housewife","Poynton, Cheshire"
"53","Edd",1,6,NA,"Cinnamon and Banana Cake",NA,"WINNER","Edd Kimber",24,"Debt collector for Yorkshire Bank","Bradford"
"54","Annetha",1,6,NA,NA,NA,NA,"Annetha Mills",30,"Midwife","Essex"
"55","David",1,6,NA,NA,NA,NA,"David Chambers",31,"Entrepreneur","Milton Keynes"
"56","Jasminder",1,6,NA,NA,NA,NA,"Jasminder Randhawa",45,"Assistant Credit Control Manager","Birmingham"
"57","Jonathan",1,6,NA,NA,NA,NA,"Jonathan Shepherd",25,"Research Analyst","St Albans"
"58","Lea",1,6,NA,NA,NA,NA,"Lea Harris",51,"Retired","Midlothian, Scotland"
"59","Louise",1,6,NA,NA,NA,NA,"Louise Brimelow",44,"Police Officer","Manchester"
"60","Mark",1,6,NA,NA,NA,NA,"Mark Whithers",48,"Bus Driver","South Wales"
"61","Ben",2,1,2,"Rhubarb and Custard CupcakesAfter Dinner Cupcakes","Vanilla Sponge with White Chocolate and Raspberry Buttercream","IN","Ben Frazer",31,"Graphic Designer","Northampton"
"62","Ian",2,1,10,"Apple and Cinnamon Cupcakes",NA,"IN","Ian Vallance",40,"Fundraiser for English Heritage","Dunstable, Bedfordshire"
"63","Janet",2,1,8,"Raspberry and Cream Cupcakes","Chocolate Marble Cakewith Dark and White Chocolate Truffles","IN","Janet Basu",63,"Teacher of Modern Languages","Formby, Liverpool"
"64","Jason",2,1,6,"Lemon Meringue CupcakesApple and Cinnamon Cupcakes",NA,"IN","Jason White",19,"Civil Engineering Student","Croydon"
"65","Joanne",2,1,11,"Chocolate Orange CupcakesOrange and Cardamom Cupcakes","Chocolate and Strawberry Cake","IN",NA,NA,NA,NA
"66","Mary-Anne",2,1,4,"Banoffee Cupcakes","Chocolate and Raspberry Opera cake","IN","Mary-Anne Boermans",45,"Housewife","Kidderminster, Worcestershire"
"67","Robert",2,1,3,"Blackberry and Vanilla Cupcakeswith Liquorice Frosting","Genoise Layered Mousse Cakewith Chocolate Ganache","IN","Robert Billington",25,"Photographer","London"
"68","Simon",2,1,9,"Guinness and Chocolate Cupcakes","Two-Tiered Chocolate Courgette Cake","IN","Simon Blackwell",31,"Rugby Coach","Norfolk"
"69","Urvashi",2,1,7,"Cherry Blossom CupcakesJapanese Lime Cupcakes",NA,"IN","Urvashi Roe",40,"Head of Marketing","Enfield, London"
"70","Yasmin",2,1,5,"Cardamom and Pomegranate Cupcakes",NA,"IN","Yasmin Limbert",43,"Childminder","West Kirby, The Wirral"
"71","Keith",2,1,12,"Earl Grey Cupcakes","Chocolate and Sour Cream Cake","OUT","Keith Batsford",31,"House husband","Arlesey, Bedfordshire"
"72","Holly",2,1,1,"Cherry Bakewell Inspired CupcakesGinger Cupcakes with Fig Truffle",NA,"STAR BAKER","Holly Bell",31,"Advertising executive","Leicester"
"73","Ben",2,2,1,"Chorizo, Pepper and Gruyere Quiche","Lemon Meringue Tarts","IN","Ben Frazer",31,"Graphic Designer","Northampton"
"74","Holly",2,2,4,"Pesto Quiche","Milk Chocolate and Pistachio TartsTrifle Tarts","IN","Holly Bell",31,"Advertising executive","Leicester"
"75","Ian",2,2,2,"Stilton, Spinach and New Potato Quichewith Paprika and Walnut Pastry",NA,"IN","Ian Vallance",40,"Fundraiser for English Heritage","Dunstable, Bedfordshire"
"76","Janet",2,2,8,"Quiche Printanière","Red Fruit TartsChocolate and Cherry Tarts","IN","Janet Basu",63,"Teacher of Modern Languages","Formby, Liverpool"
"77","Joanne",2,2,10,"Caramelised Onion, Gruyere and Thyme Quiche","Raspberry and Mascarpone Tarts with Lemon and Almond PastryHoney and Almond Tarts with Sweetcrust","IN",NA,NA,NA,NA
"78","Mary-Anne",2,2,9,"Roasted Cauliflower, Cheese andCaramelised Onion Quiche","Butterscotch Brulée Tarts in Pecan PastryApple Rose Tarts","IN","Mary-Anne Boermans",45,"Housewife","Kidderminster, Worcestershire"
"79","Robert",2,2,5,"Smoked Bacon and Kale Quiche","Chocolate, Fennel and Ginger TartAlmond, Creme Patissiere and Poached Pear Tart","IN","Robert Billington",25,"Photographer","London"
"80","Urvashi",2,2,7,"Crab, Coriander and Coconut Quiche","Strawberry and Basil TartsElderflower and Honeycomb Tarts","IN","Urvashi Roe",40,"Head of Marketing","Enfield, London"
"81","Yasmin",2,2,6,"Smoked Haddock and Watercress Quiche","Chocolate and Orange with Cinnamon-Orange Pastry TartsBlueberry and Hazelnut with Hazelnut Pastry Tarts","IN","Yasmin Limbert",43,"Childminder","West Kirby, The Wirral"
"82","Simon",2,2,11,"Smoked Haddock and Watercress Quiche","Passion Fruit and Ricotta TartsSalted Chocolate, Stem Ginger and Mascarpone Cream Tarts","OUT","Simon Blackwell",31,"Rugby Coach","Norfolk"
"83","Jason",2,2,3,"Salmon and Pak Choi Quiche","Mint Chocolate Tarts Blueberry Bakewell Tarts","STAR BAKER","Jason White",19,"Civil Engineering Student","Croydon"
"84","Keith",2,2,NA,NA,NA,NA,"Keith Batsford",31,"House husband","Arlesey, Bedfordshire"
"85","Ben",2,3,3,"Walnut, Raisin and Rosemary Loaf",NA,"IN","Ben Frazer",31,"Graphic Designer","Northampton"
"86","Holly",2,3,6,"Picnic Loaf","Stilton and Walnut Rolls","IN","Holly Bell",31,"Advertising executive","Leicester"
"87","Janet",2,3,8,"Zupfe Loaf with Gruyère Cheese","Apple and Walnut Granary Rolls Red Onion Cottage Rolls","IN","Janet Basu",63,"Teacher of Modern Languages","Formby, Liverpool"
"88","Jason",2,3,7,"Cheese and Onion Tear and Share Loaf",NA,"IN","Jason White",19,"Civil Engineering Student","Croydon"
"89","Joanne",2,3,1,"Stromboli flavored with Mozzarella, Ham, and Picante Pepper","Unknown","IN",NA,NA,NA,NA
"90","Mary-Anne",2,3,5,"Ploughman's Loaf","Herb and Walnut BreadsChocolate and Chilli Buns","IN","Mary-Anne Boermans",45,"Housewife","Kidderminster, Worcestershire"
"91","Robert",2,3,4,"Rye and Coriander Seed Loaf","Blueberry Brioche RollsLemon and Poppy Seed Rolls","IN","Robert Billington",25,"Photographer","London"
"92","Ian",2,3,10,"Courgette, Caerphilly Cheese and Thyme Loaf","Walnut and Raisin RollsCracked Wheat Logs","OUT","Ian Vallance",40,"Fundraiser for English Heritage","Dunstable, Bedfordshire"
"93","Urvashi",2,3,9,"Salt and Peppercorn Loaf","Chilli and Halloumi RollsLemon and Coriander Mini Loaves","OUT","Urvashi Roe",40,"Head of Marketing","Enfield, London"
"94","Yasmin",2,3,2,"Egyptian Dukkah Loaf with Mixed Spices","Pesto Bread
Sweet Coconut Rolls","STAR BAKER","Yasmin Limbert",43,"Childminder","West Kirby, The Wirral"
"95","Keith",2,3,NA,NA,NA,NA,"Keith Batsford",31,"House husband","Arlesey, Bedfordshire"
"96","Simon",2,3,NA,NA,NA,NA,"Simon Blackwell",31,"Rugby Coach","Norfolk"
"97","Janet",2,4,4,"Christmas Marzipan Biscuits","Raspberry Macarons
Blackcurrant Macarons
Almond Macarons","IN","Janet Basu",63,"Teacher of Modern Languages","Formby, Liverpool"
"98","Joanne",2,4,8,"Lavender Biscuits","Blueberry MacaronsCoconut MacaronsStrawberry Macarons","IN",NA,NA,NA,NA
"99","Mary-Anne",2,4,2,"Melting Moments","Blackcurrant and Mint MacaronsGooseberry and Elderflower MacaronsHazelnut Macarons","IN","Mary-Anne Boermans",45,"Housewife","Kidderminster, Worcestershire"
"100","Robert",2,4,7,"Chocolate and Ginger Oat Biscuits","Strawberry and Lime MacaronsLemon MacaronsChocolate and Cardamom Macarons","IN","Robert Billington",25,"Photographer","London"
"101","Yasmin",2,4,6,"Chocolate Chip and Pistachio Biscotti","Chocolate and Lime MacaronsCoffee and Walnut MacaronsPineapple and Coconut Macarons","IN","Yasmin Limbert",43,"Childminder","West Kirby, The Wirral"
"102","Ben",2,4,5,"Stem Ginger Nuts","Chocolate and Almond MacaronsPine Nut MacaronsPistachio Macarons","OUT","Ben Frazer",31,"Graphic Designer","Northampton"
"103","Holly",2,4,3,"Strawberry and Custard Melts","'Chocolate bars of my youth'
(Caramel Macarons, Mint Chocolate Macarons and Chocolate Orange Macarons)","STAR BAKER","Holly Bell",31,"Advertising executive","Leicester"
"104","Jason",2,4,1,"Lebkuchen","Mocktail Macarons
(Mojito, Cranberry Cooler, and Pina Colada)","STAR BAKER","Jason White",19,"Civil Engineering Student","Croydon"
"105","Ian",2,4,NA,NA,NA,NA,"Ian Vallance",40,"Fundraiser for English Heritage","Dunstable, Bedfordshire"
"106","Keith",2,4,NA,NA,NA,NA,"Keith Batsford",31,"House husband","Arlesey, Bedfordshire"
"107","Simon",2,4,NA,NA,NA,NA,"Simon Blackwell",31,"Rugby Coach","Norfolk"
"108","Urvashi",2,4,NA,NA,NA,NA,"Urvashi Roe",40,"Head of Marketing","Enfield, London"
"109","Holly",2,5,4,"Stilton, Potato and Caramelised Onion Pie","Lime Meringue Pie","IN","Holly Bell",31,"Advertising executive","Leicester"
"110","Joanne",2,5,6,"Salmon and Asparagus Pie","Apple and Raspberry Meringue Pie","IN",NA,NA,NA,NA
"111","Mary-Anne",2,5,2,"Chicken and Bacon Pie","Midnight Meringue","IN","Mary-Anne Boermans",45,"Housewife","Kidderminster, Worcestershire"
"112","Yasmin",2,5,5,"Family Fish Pie","Peach and Raspberry Meringue Pie","IN","Yasmin Limbert",43,"Childminder","West Kirby, The Wirral"
"113","Jason",2,5,7,"Brown Down Chicken Pie","Plum Meringue Pie","OUT","Jason White",19,"Civil Engineering Student","Croydon"
"114","Robert",2,5,3,"Chicken and Mushroom Pie","Rhubarb and Custard Meringue Pie","OUT","Robert Billington",25,"Photographer","London"
"115","Janet",2,5,1,"Chicken and Chestnut Pie","Rhubarb Meringue Pie","STAR BAKER","Janet Basu",63,"Teacher of Modern Languages","Formby, Liverpool"
"116","Ben",2,5,NA,NA,NA,NA,"Ben Frazer",31,"Graphic Designer","Northampton"
"117","Ian",2,5,NA,NA,NA,NA,"Ian Vallance",40,"Fundraiser for English Heritage","Dunstable, Bedfordshire"
"118","Keith",2,5,NA,NA,NA,NA,"Keith Batsford",31,"House husband","Arlesey, Bedfordshire"
"119","Simon",2,5,NA,NA,NA,NA,"Simon Blackwell",31,"Rugby Coach","Norfolk"
"120","Urvashi",2,5,NA,NA,NA,NA,"Urvashi Roe",40,"Head of Marketing","Enfield, London"
"121","Holly",2,6,3,"Father Christmas' Baked Cheesecake","Hansel and Gretel's Croquembouche","IN","Holly Bell",31,"Advertising executive","Leicester"
"122","Janet",2,6,5,"Rhubarb and Ginger Baked Cheesecake","Orange and Nougatine Croquembouche","IN","Janet Basu",63,"Teacher of Modern Languages","Formby, Liverpool"
"123","Mary-Anne",2,6,4,"Tutti Fruitti Curd Baked Cheesecake","Orange and Praline Croquembouche with Cardamom Caramel","IN","Mary-Anne Boermans",45,"Housewife","Kidderminster, Worcestershire"
"124","Yasmin",2,6,2,"Baked Amaretto Cheesecake","Rose Croquembouche","OUT","Yasmin Limbert",43,"Childminder","West Kirby, The Wirral"
"125","Joanne",2,6,1,"Rum and Raisin Baked Cheesecake","Limoncello and White Chocolate Croquembouche","STAR BAKER",NA,NA,NA,NA
"126","Ben",2,6,NA,NA,NA,NA,"Ben Frazer",31,"Graphic Designer","Northampton"
"127","Ian",2,6,NA,NA,NA,NA,"Ian Vallance",40,"Fundraiser for English Heritage","Dunstable, Bedfordshire"
"128","Jason",2,6,NA,NA,NA,NA,"Jason White",19,"Civil Engineering Student","Croydon"
"129","Keith",2,6,NA,NA,NA,NA,"Keith Batsford",31,"House husband","Arlesey, Bedfordshire"
"130","Robert",2,6,NA,NA,NA,NA,"Robert Billington",25,"Photographer","London"
"131","Simon",2,6,NA,NA,NA,NA,"Simon Blackwell",31,"Rugby Coach","Norfolk"
"132","Urvashi",2,6,NA,NA,NA,NA,"Urvashi Roe",40,"Head of Marketing","Enfield, London"
"133","Holly",2,7,1,"White Chocolate, Hazelnut and Raspberry Genoise Mousse Cake","Apricot, Macadamia and White Chocolate PinwheelsAlmond CroissantsApple, Raisin and Cinnamon Plaits","IN","Holly Bell",31,"Advertising executive","Leicester"
"134","Joanne",2,7,3,"Raspberry & Strawberry Mousse Cake","Pain Aux RaisinChocolate TwistsBanana and Raisin Pastries","IN",NA,NA,NA,NA
"135","Mary-Anne",2,7,2,"Chocolate and Orange Mousse Cake","Raspberry Rose DanishesPraline SpiralsAlsatian Plaited Danishes","IN","Mary-Anne Boermans",45,"Housewife","Kidderminster, Worcestershire"
"136","Janet",2,7,4,"Chocolate Amaretto Mousse Cake","Pain Aux RaisinPlain CroissantPain Au Chocolat","OUT","Janet Basu",63,"Teacher of Modern Languages","Formby, Liverpool"
"137","Ben",2,7,NA,NA,NA,NA,"Ben Frazer",31,"Graphic Designer","Northampton"
"138","Ian",2,7,NA,NA,NA,NA,"Ian Vallance",40,"Fundraiser for English Heritage","Dunstable, Bedfordshire"
"139","Jason",2,7,NA,NA,NA,NA,"Jason White",19,"Civil Engineering Student","Croydon"
"140","Keith",2,7,NA,NA,NA,NA,"Keith Batsford",31,"House husband","Arlesey, Bedfordshire"
"141","Robert",2,7,NA,NA,NA,NA,"Robert Billington",25,"Photographer","London"
"142","Simon",2,7,NA,NA,NA,NA,"Simon Blackwell",31,"Rugby Coach","Norfolk"
"143","Urvashi",2,7,NA,NA,NA,NA,"Urvashi Roe",40,"Head of Marketing","Enfield, London"
"144","Yasmin",2,7,NA,NA,NA,NA,"Yasmin Limbert",43,"Childminder","West Kirby, The Wirral"
"145","Holly",2,8,2,"Banoffee Inspired Mille Feuille","Strawberry and Cream Meringue NestGooseberry and Elderflower 'Bakewell' TartsNeapolitan Ice-Cream Sandwich","Runner-up","Holly Bell",31,"Advertising executive","Leicester"
"146","Mary-Anne",2,8,3,"Lemon and Ginger Mille Feuille","Fruit Tarts with Elderflower CustardStrawberry and Rhubarb CheesecakesBlack Fruit Meringue with Everlasting Syllabub","Runner-up","Mary-Anne Boermans",45,"Housewife","Kidderminster, Worcestershire"
"147","Joanne",2,8,1,"Raspberry and Blueberry Mille Feuille","Mini Victoria SandwichesRaspberry, White Chocolate and Pistachio Mini MeringuesMini Banoffee Pie with Banana Mousse","WINNER",NA,NA,NA,NA
"148","Ben",2,8,NA,NA,NA,NA,"Ben Frazer",31,"Graphic Designer","Northampton"
"149","Ian",2,8,NA,NA,NA,NA,"Ian Vallance",40,"Fundraiser for English Heritage","Dunstable, Bedfordshire"
"150","Janet",2,8,NA,NA,NA,NA,"Janet Basu",63,"Teacher of Modern Languages","Formby, Liverpool"
"151","Jason",2,8,NA,NA,NA,NA,"Jason White",19,"Civil Engineering Student","Croydon"
"152","Keith",2,8,NA,NA,NA,NA,"Keith Batsford",31,"House husband","Arlesey, Bedfordshire"
"153","Robert",2,8,NA,NA,NA,NA,"Robert Billington",25,"Photographer","London"
"154","Simon",2,8,NA,NA,NA,NA,"Simon Blackwell",31,"Rugby Coach","Norfolk"
"155","Urvashi",2,8,NA,NA,NA,NA,"Urvashi Roe",40,"Head of Marketing","Enfield, London"
"156","Yasmin",2,8,NA,NA,NA,NA,"Yasmin Limbert",43,"Childminder","West Kirby, The Wirral"
"157","Brendan",3,1,10,"Plum, Sour Cherry & Walnut",NA,"IN","Brendan Lynch",63,"Recruitment consultant","Sutton Coldfield"
"158","Cathryn",3,1,5,"Apple, Hazelnut and Calvados","Hidden Cupcake Cake","IN","Cathryn Dresser",27,"Shop assistant","Pease Pottage, West Sussex"
"159","Danny",3,1,7,"Plum, Ginger & Orange",NA,"IN","Danny Bryden",45,"Intensive care consultant","Sheffield"
"160","James",3,1,2,"Parsnip, Pear, and Pecan","""Simmer Dim"" Sunset Cake","IN","James Morton",21,"Medical student","Hillswick, Shetland Islands"
"161","John",3,1,11,"Toffee Apple, Orange & Cranberry","Hidden Pink Hearts Cake","IN","John Whaite",22,"Law student","Wigan"
"162","Manisha",3,1,6,"Vanilla, Peach and Raspberry","White Chocolate Cake with a Red Velvet and White Chocolate Mousse Heart","IN","Manisha Parmar",27,"Nursery nurse","Leicester"
"163","Peter",3,1,3,"Pear, Muscat & Chocolate","Jubilee Cake","IN","Peter Maloney",43,"Sales manager","Windsor, Berkshire"
"164","Ryan",3,1,8,"Kumquat and Orange Polenta","Hidden Flowerbed Mousse Cake","IN","Ryan Chong",38,"Photographer","Bristol"
"165","Sarah-Jane",3,1,1,"Pear, Chocolate and Hazelnut","Hidden Crown Cake","IN","Sarah-Jane Willis",28,"Vicar's wife","Bewbush, West Sussex"
"166","Stuart",3,1,9,"Tomato and Ginger","Lemon and Pistachio Union Flag Cake","IN","Stuart Marston-Smith",26,"PE teacher","Lichfield, Staffordshire"
"167","Natasha",3,1,12,"Pineapple & Passion Fruit","Mother's Day Layered Rose Cake","OUT","Natasha Stringer",36,"Midwife","Tamworth, Staffordshire"
"168","Victoria",3,1,4,"Pear and Pecan","Blackbird Pie Cake","STAR BAKER","Victoria Chester",50,"CEO of the charity Plantlife","Somerset"
"169","Brendan",3,2,4,"Middle Eastern Taboon BreadIndian Rotis","Chocolate and Vanilla Bagels
Cumin and Gruyere Bagels","IN","Brendan Lynch",63,"Recruitment consultant","Sutton Coldfield"
"170","Cathryn",3,2,8,"Spiced Mango NaanLime, Coriander and Chilli Tortillas","Cranberry and Orange Bagels
Chipotle, Chili, and Smoked Cheddar Bagels","IN","Cathryn Dresser",27,"Shop assistant","Pease Pottage, West Sussex"
"171","Danny",3,2,3,"Lime Coriander and Coconut TortillasZaatar Naan with Dukkah",NA,"IN","Danny Bryden",45,"Intensive care consultant","Sheffield"
"172","James",3,2,2,"Tomato, Garlic, and Parmesan FlatbreadsTattie Scones","Orange, Mint and Chocolate Bagels
'Millers' Sourdough Bagels","IN","James Morton",21,"Medical student","Hillswick, Shetland Islands"
"173","Manisha",3,2,6,"Indian FlatbreadsItalian Flatbreads",NA,"IN","Manisha Parmar",27,"Nursery nurse","Leicester"
"174","Ryan",3,2,5,"Shanghai Spring Onion FlatbreadsGarlic and Coriander Naan","Cinnamon and Date Bagels
Tarragon and Rosemary Bagels","IN","Ryan Chong",38,"Photographer","Bristol"
"175","Sarah-Jane",3,2,10,"Toasted Coconut and Lime RotisOatcakes",NA,"IN","Sarah-Jane Willis",28,"Vicar's wife","Bewbush, West Sussex"
"176","Stuart",3,2,9,"Bombay BreadChorizo and Spring Onion Naan","Cinnamon and Cranberry Bagels
Tomato and Thyme Bagels","IN","Stuart Marston-Smith",26,"PE teacher","Lichfield, Staffordshire"
"177","Victoria",3,2,7,"Coriander and Lemon NaanGarlic and Parsnip Chapatis","Saffron and Golden Raisin Bagels
Porcini Bagels","IN","Victoria Chester",50,"CEO of the charity Plantlife","Somerset"
"178","Peter",3,2,11,"Fennel and Nigella Seed NaanBannock Bread","Rosemary and Sea Salt Bagels
Apple and Cinnamon Bagels","OUT","Peter Maloney",43,"Sales manager","Windsor, Berkshire"
"179","John",3,2,1,"Coriander and Chilli RotisGarlic, Pomegranate and Potato Pitas","Fig, Walnut and Gruyere Bagels
Blueberry and White Chocolate Bagels","STAR BAKER","John Whaite",22,"Law student","Wigan"
"180","Natasha",3,2,NA,NA,NA,NA,"Natasha Stringer",36,"Midwife","Tamworth, Staffordshire"
"181","Brendan",3,3,9,"Apple and Ginger Tarte Tatin","Blackberry, Nectarine and Dragon Fruit Tart","IN","Brendan Lynch",63,"Recruitment consultant","Sutton Coldfield"
"182","Cathryn",3,3,3,"Plum, Cherry and Five Spice Tarte Tatin","Raspberry, Pistachio and Lemon Tart","IN","Cathryn Dresser",27,"Shop assistant","Pease Pottage, West Sussex"
